{
  "schemaVersion": 1,
  "mode": "migrate",
  "provenance": {
    "generatedBy": "engine",
    "bobModes": [
      "uplift-migration-planner",
      "uplift-convention-scanner",
      "uplift-worker-users",
      "uplift-worker-core",
      "uplift-verifier"
    ],
    "generatedAt": "2026-09-27T10:02:49.188131+00:00"
  },
  "scenario": {
    "id": "s3-pydantic2",
    "title": "S3 \u2014 Pydantic v1 to v2 upgrade"
  },
  "change": {
    "summary": "Dependency upgrade: pydantic 1.10.13 -> 2.9.2",
    "kind": "dependency-upgrade",
    "library": "pydantic",
    "from": "1.10.13",
    "to": "2.9.2"
  },
  "changedSymbols": [
    {
      "id": "requirements.txt#pydantic",
      "kind": "dependency",
      "changeType": "dependency"
    }
  ],
  "affected": [
    {
      "id": "sample-app/shop/config.py#config.py",
      "file": "sample-app/shop/config.py",
      "line": 1,
      "hop": 1,
      "layer": "direct",
      "via": "requirements.txt#pydantic",
      "verdict": "unknown",
      "reason": "",
      "fix": "",
      "proof": {
        "status": "not_attempted"
      },
      "module": "config.py"
    },
    {
      "id": "sample-app/shop/payments/schemas.py#payments",
      "file": "sample-app/shop/payments/schemas.py",
      "line": 7,
      "hop": 1,
      "layer": "direct",
      "via": "requirements.txt#pydantic",
      "verdict": "unknown",
      "reason": "",
      "fix": "",
      "proof": {
        "status": "not_attempted"
      },
      "module": "payments"
    }
  ],
  "contracts": [],
  "testsToRun": [],
  "untested": [],
  "risk": {
    "score": 0,
    "level": "low",
    "factors": [
      "0 will_break (+0)",
      "0 might_break (+0)",
      "0 untested affected item (+0)",
      "0 contract hit (+0)"
    ]
  },
  "pipeline": {
    "predict": "done",
    "prove": "pending",
    "repair": "done",
    "verify": "done"
  },
  "migration": {
    "catalog": [
      {
        "id": "basesettings-moved",
        "title": "BaseSettings moved to pydantic-settings package",
        "kind": "api_removed",
        "guideSection": "BaseSettings has moved to pydantic-settings",
        "detect": {
          "type": "import",
          "pattern": "from pydantic import BaseSettings"
        },
        "replacement": "from pydantic_settings import BaseSettings  (pip install pydantic-settings)"
      },
      {
        "id": "config-class-deprecated",
        "title": "Inner class Config is deprecated; use model_config = ConfigDict(...) instead",
        "kind": "syntax",
        "guideSection": "Changes to config",
        "detect": {
          "type": "regex",
          "pattern": "^\\s+class Config:"
        },
        "replacement": "model_config = ConfigDict(...)"
      },
      {
        "id": "orm-mode-renamed",
        "title": "Config key orm_mode renamed to from_attributes",
        "kind": "api_changed",
        "guideSection": "Changes to config",
        "detect": {
          "type": "identifier",
          "pattern": "orm_mode"
        },
        "replacement": "model_config = ConfigDict(from_attributes=True)"
      },
      {
        "id": "validator-deprecated",
        "title": "@validator deprecated; replace with @field_validator",
        "kind": "api_changed",
        "guideSection": "@validator and @root_validator are deprecated",
        "detect": {
          "type": "regex",
          "pattern": "@validator\\("
        },
        "replacement": "@field_validator(...)"
      },
      {
        "id": "validator-each-item",
        "title": "@validator each_item=True not supported in @field_validator; iterate in body instead",
        "kind": "api_changed",
        "guideSection": "@validator and @root_validator are deprecated",
        "detect": {
          "type": "regex",
          "pattern": "each_item\\s*=\\s*True"
        },
        "replacement": "Use mode='before' and iterate: return [v.strip() for v in value]"
      },
      {
        "id": "root-validator-deprecated",
        "title": "@root_validator deprecated; replace with @model_validator",
        "kind": "api_changed",
        "guideSection": "@validator and @root_validator are deprecated",
        "detect": {
          "type": "regex",
          "pattern": "@root_validator"
        },
        "replacement": "@model_validator(mode='before') or mode='after'"
      },
      {
        "id": "field-regex-removed",
        "title": "Field(regex=...) kwarg removed; use Field(pattern=...) instead",
        "kind": "api_removed",
        "guideSection": "Changes to pydantic.Field",
        "detect": {
          "type": "regex",
          "pattern": "Field\\(.*regex\\s*="
        },
        "replacement": "Field(..., pattern=r'...')"
      },
      {
        "id": "constr-regex-removed",
        "title": "constr(regex=...) removed; use Annotated[str, StringConstraints(pattern=...)] instead",
        "kind": "api_removed",
        "guideSection": "Constrained types",
        "detect": {
          "type": "regex",
          "pattern": "constr\\(.*regex\\s*="
        },
        "replacement": "Annotated[str, StringConstraints(pattern=r'...')]"
      },
      {
        "id": "constrained-types-removed",
        "title": "ConstrainedInt, ConstrainedStr, etc. removed; use Annotated[type, Field(...)] instead",
        "kind": "api_removed",
        "guideSection": "Constrained types",
        "detect": {
          "type": "regex",
          "pattern": "Constrained(Int|Str|Float|Decimal|Bytes|List|Set|FrozenSet|Date)"
        },
        "replacement": "Annotated[int, Field(ge=0)] or Annotated[str, StringConstraints(...)]"
      },
      {
        "id": "optional-required-semantics",
        "title": "Optional[T] without default is now required (no implicit None default)",
        "kind": "behavior_changed",
        "guideSection": "Required, optional, and nullable fields",
        "detect": {
          "type": "regex",
          "pattern": ":\\s*Optional\\[\\w+\\]\\s*$"
        },
        "replacement": "Add = None if field should be optional: field: Optional[str] = None"
      },
      {
        "id": "dict-method-renamed",
        "title": ".dict() renamed to .model_dump()",
        "kind": "api_changed",
        "guideSection": "Changes to pydantic.BaseModel",
        "detect": {
          "type": "regex",
          "pattern": "\\.dict\\(\\)"
        },
        "replacement": ".model_dump()"
      },
      {
        "id": "parse-obj-renamed",
        "title": "parse_obj() renamed to model_validate()",
        "kind": "api_changed",
        "guideSection": "Changes to pydantic.BaseModel",
        "detect": {
          "type": "call",
          "pattern": "parse_obj"
        },
        "replacement": "Model.model_validate(data)"
      },
      {
        "id": "from-orm-deprecated",
        "title": "from_orm() deprecated; use model_validate() with from_attributes=True in model_config",
        "kind": "api_changed",
        "guideSection": "Changes to pydantic.BaseModel",
        "detect": {
          "type": "call",
          "pattern": "\\.from_orm\\("
        },
        "replacement": "Model.model_validate(obj) after model_config = ConfigDict(from_attributes=True)"
      }
    ],
    "modules": []
  },
  "metrics": {
    "filesScanned": 25,
    "secondsTaken": 0.0,
    "predicted": 0,
    "confirmed": 0,
    "unconfirmed": 0,
    "fixed": 0,
    "regressions": 0
  }
}