{
  "schemaVersion": 1,
  "mode": "impact",
  "provenance": {
    "generatedBy": "engine",
    "bobModes": [
      "uplift-impact-analyst",
      "uplift-prover",
      "uplift-worker-orders",
      "uplift-worker-users",
      "uplift-verifier"
    ],
    "generatedAt": "2026-09-27T10:01:02.166634+00:00"
  },
  "scenario": {
    "id": "s1-null-user",
    "title": "S1 \u2014 Null user return (get_user returns None)"
  },
  "change": {
    "summary": "Scenario s1-null-user",
    "kind": "patch"
  },
  "changedSymbols": [
    {
      "id": "shop/users/service.py#get_user",
      "kind": "function",
      "changeType": "behavior",
      "hints": [
        "raise removed",
        "None check removed"
      ]
    }
  ],
  "affected": [
    {
      "id": "shop/admin/reports.py#user_spend_report",
      "file": "shop/admin/reports.py",
      "line": 11,
      "hop": 1,
      "layer": "direct",
      "verdict": "unknown",
      "reason": "",
      "fix": "",
      "proof": {
        "status": "not_attempted"
      },
      "module": "admin",
      "via": "shop/users/service.py#get_user",
      "snippet": "def user_spend_report() -> list:\n    rows = []\n    for order in order_repo.all_orders():\n        rows.append({\"user\": get_user(order.user_id).name, \"total\": order.total})\n    return rows\n\n\ndef revenue_total(payments: List[Payment]) -> float:",
      "tests": []
    },
    {
      "id": "shop/notifications/email.py#send_welcome",
      "file": "shop/notifications/email.py",
      "line": 7,
      "hop": 1,
      "layer": "direct",
      "verdict": "unknown",
      "reason": "",
      "fix": "",
      "proof": {
        "status": "not_attempted"
      },
      "module": "notifications",
      "via": "shop/users/service.py#get_user",
      "snippet": "\n\ndef send_welcome(user_id: int) -> bool:\n    user = get_user(user_id)\n    if user is None:\n        return False\n    settings = get_settings()\n    return bool(f\"from {settings.sender} to {user.email}\")",
      "tests": [
        "tests/notifications/test_email.py"
      ]
    },
    {
      "id": "shop/orders/invoice.py#build_invoice",
      "file": "shop/orders/invoice.py",
      "line": 7,
      "hop": 1,
      "layer": "direct",
      "verdict": "unknown",
      "reason": "",
      "fix": "",
      "proof": {
        "status": "not_attempted"
      },
      "module": "orders",
      "via": "shop/users/service.py#get_user",
      "snippet": "\n\ndef build_invoice(order: Order) -> dict:\n    user = get_user(order.user_id)\n    return {\n        \"to\": user.email,\n        \"lines\": [{\"label\": \"order\", \"amount\": order.total}],\n        \"total\": order.total,",
      "tests": [
        "tests/orders/test_invoice.py"
      ]
    },
    {
      "id": "shop/orders/service.py#create_order",
      "file": "shop/orders/service.py",
      "line": 9,
      "hop": 1,
      "layer": "direct",
      "verdict": "unknown",
      "reason": "",
      "fix": "",
      "proof": {
        "status": "not_attempted"
      },
      "module": "orders",
      "via": "shop/users/service.py#get_user",
      "snippet": "\ndef create_order(data: OrderIn) -> repo.Order:\n    try:\n        get_user(data.user_id)\n    except NotFoundError:\n        raise ValidationError(\"unknown user\")\n    total = sum(data.items)\n    return repo.save_order(data.user_id, total)",
      "tests": [
        "tests/orders/test_routes.py",
        "tests/orders/test_service.py"
      ]
    },
    {
      "id": "shop/payments/charge.py#charge",
      "file": "shop/payments/charge.py",
      "line": 13,
      "hop": 1,
      "layer": "direct",
      "verdict": "unknown",
      "reason": "",
      "fix": "",
      "proof": {
        "status": "not_attempted"
      },
      "module": "payments",
      "via": "shop/users/service.py#get_user",
      "snippet": "\n\ndef charge(user_id: int, amount: float) -> Payment:\n    get_user(user_id)\n    fee = round(amount * 0.029 + 0.30, 2)\n    return Payment(user_id, round(amount + fee, 2))",
      "tests": [
        "tests/notifications/test_email.py",
        "tests/orders/test_invoice.py",
        "tests/payments/test_charge.py",
        "tests/payments/test_receipt.py",
        "tests/payments/test_receipt_more.py",
        "tests/payments/test_repo.py",
        "tests/payments/test_routes.py"
      ]
    },
    {
      "id": "shop/payments/receipt.py#render_receipt",
      "file": "shop/payments/receipt.py",
      "line": 6,
      "hop": 1,
      "layer": "direct",
      "verdict": "unknown",
      "reason": "",
      "fix": "",
      "proof": {
        "status": "not_attempted"
      },
      "module": "payments",
      "via": "shop/users/service.py#get_user",
      "snippet": "\n\ndef render_receipt(payment: Payment) -> str:\n    user = get_user(payment.user_id)\n    return f\"Receipt for {user.name}: ${payment.amount:.2f}\"",
      "tests": [
        "tests/payments/test_receipt.py",
        "tests/payments/test_receipt_more.py"
      ]
    },
    {
      "id": "shop/users/routes.py#get_user_route",
      "file": "shop/users/routes.py",
      "line": 13,
      "hop": 1,
      "layer": "direct",
      "verdict": "unknown",
      "reason": "",
      "fix": "",
      "proof": {
        "status": "not_attempted"
      },
      "module": "users",
      "via": "shop/users/service.py#get_user",
      "snippet": "\n@router.get(\"/{user_id}\", response_model=UserOut)\ndef get_user_route(user_id: int):\n    return service.get_user(user_id)\n\n\n@router.get(\"\", response_model=List[UserOut])\ndef list_users_route():",
      "tests": [
        "tests/users/test_routes.py"
      ]
    },
    {
      "id": "shop/orders/routes.py#post_order",
      "file": "shop/orders/routes.py",
      "line": 11,
      "hop": 2,
      "layer": "indirect",
      "verdict": "unknown",
      "reason": "",
      "fix": "",
      "proof": {
        "status": "not_attempted"
      },
      "module": "orders",
      "via": "shop/orders/service.py#create_order",
      "snippet": "\n@router.post(\"\", response_model=OrderOut)\ndef post_order(payload: OrderIn):\n    return service.create_order(payload)\n\n\n@router.get(\"/{order_id}\", response_model=OrderOut)\ndef get_order_route(order_id: int):",
      "tests": [
        "tests/orders/test_routes.py"
      ]
    },
    {
      "id": "shop/payments/routes.py#post_payment",
      "file": "shop/payments/routes.py",
      "line": 11,
      "hop": 2,
      "layer": "indirect",
      "verdict": "unknown",
      "reason": "",
      "fix": "",
      "proof": {
        "status": "not_attempted"
      },
      "module": "payments",
      "via": "shop/payments/charge.py#charge",
      "snippet": "\n@router.post(\"\")\ndef post_payment(payload: PaymentIn):\n    payment = repo.save_payment(charge.charge(payload.user_id, payload.amount))\n    return {\"user_id\": payment.user_id, \"amount\": payment.amount}",
      "tests": [
        "tests/payments/test_routes.py"
      ]
    }
  ],
  "contracts": [
    {
      "type": "route",
      "id": "GET /users/{user_id}",
      "handler": "shop/users/routes.py#get_user_route",
      "verdict": "unknown"
    },
    {
      "type": "route",
      "id": "POST /orders",
      "handler": "shop/orders/routes.py#post_order",
      "verdict": "unknown"
    },
    {
      "type": "route",
      "id": "POST /payments",
      "handler": "shop/payments/routes.py#post_payment",
      "verdict": "unknown"
    }
  ],
  "testsToRun": [
    "tests/notifications/test_email.py",
    "tests/orders/test_invoice.py",
    "tests/orders/test_routes.py",
    "tests/orders/test_service.py",
    "tests/payments/test_charge.py",
    "tests/payments/test_receipt.py",
    "tests/payments/test_receipt_more.py",
    "tests/payments/test_repo.py",
    "tests/payments/test_routes.py",
    "tests/users/test_routes.py"
  ],
  "untested": [
    "shop/admin/reports.py#user_spend_report"
  ],
  "risk": {
    "score": 12,
    "level": "low",
    "factors": [
      "0 will_break (+0)",
      "0 might_break (+0)",
      "1 untested affected item (+12)",
      "0 contract hit (+0)"
    ]
  },
  "pipeline": {
    "predict": "done",
    "prove": "pending",
    "repair": "pending",
    "verify": "pending"
  },
  "migration": null,
  "metrics": {
    "filesScanned": 25,
    "secondsTaken": 0.5,
    "predicted": 0,
    "confirmed": 0,
    "unconfirmed": 0,
    "fixed": 0,
    "regressions": 0,
    "accuracy": {
      "precision": 0.0,
      "recall": 0.0,
      "truePositives": 0,
      "falsePositives": 0,
      "falseNegatives": 6
    }
  }
}