{
  "schemaVersion": 1,
  "mode": "migrate",
  "provenance": { "generatedBy": "mock", "bobModes": [], "generatedAt": "2026-09-26T00:00:00Z" },
  "scenario": { "id": "s3-pydantic2", "title": "Upgrade Pydantic v1 to v2", "description": "Bob reads the official migration guide, predicts what breaks, proves it on Pydantic v2, then fixes each module with a sandboxed worker." },
  "change": { "summary": "pydantic 1.10.x to 2.x (fastapi bumped to a v2-compatible release)", "kind": "dependency-upgrade", "library": "pydantic", "from": "1.10.13", "to": "2.9.0" },
  "changedSymbols": [
    { "id": "requirements.txt#pydantic", "kind": "dependency", "changeType": "dependency", "hints": ["major version bump"] }
  ],
  "affected": [
    { "id": "shop/config.py#Settings", "file": "shop/config.py", "line": 3, "module": "core", "hop": 1, "layer": "direct", "via": "requirements.txt#pydantic", "snippet": "from pydantic import BaseSettings", "tests": ["tests/notifications/test_email.py"], "verdict": "will_break", "reason": "BaseSettings moved to the pydantic-settings package in v2.", "fix": "Import BaseSettings from pydantic_settings and add it to requirements.txt.", "proof": { "status": "confirmed", "passesOnBase": true, "failsOnHead": true }, "repair": { "status": "fixed", "worker": "uplift-worker-core", "filesChanged": ["shop/config.py", "requirements.txt"] } },
    { "id": "shop/users/schemas.py#UserOut", "file": "shop/users/schemas.py", "line": 14, "module": "users", "hop": 1, "layer": "direct", "via": "requirements.txt#pydantic", "snippet": "class Config:\n    orm_mode = True", "tests": ["tests/users/test_routes.py"], "verdict": "will_break", "reason": "orm_mode was renamed to from_attributes; serialization of ORM objects fails.", "fix": "Use model_config = ConfigDict(from_attributes=True).", "proof": { "status": "confirmed", "passesOnBase": true, "failsOnHead": true }, "repair": { "status": "fixed", "worker": "uplift-worker-users", "filesChanged": ["shop/users/schemas.py"] } },
    { "id": "shop/orders/schemas.py#OrderIn", "file": "shop/orders/schemas.py", "line": 22, "module": "orders", "hop": 1, "layer": "direct", "via": "requirements.txt#pydantic", "snippet": "note: Optional[str]", "tests": ["tests/orders/test_service.py"], "verdict": "will_break", "reason": "Optional fields without a default became required in v2.", "fix": "Give the field a default of None.", "proof": { "status": "confirmed", "passesOnBase": true, "failsOnHead": true }, "repair": { "status": "fixed", "worker": "uplift-worker-orders", "filesChanged": ["shop/orders/schemas.py"] } },
    { "id": "shop/payments/schemas.py#PaymentIn", "file": "shop/payments/schemas.py", "line": 9, "module": "payments", "hop": 1, "layer": "direct", "via": "requirements.txt#pydantic", "snippet": "card: str = Field(..., regex=r\"^\\d{16}$\")", "tests": ["tests/payments/test_routes.py"], "verdict": "will_break", "reason": "Field(regex=...) was renamed to pattern.", "fix": "Use Field(..., pattern=...).", "proof": { "status": "confirmed", "passesOnBase": true, "failsOnHead": true }, "repair": { "status": "fixed", "worker": "uplift-worker-payments", "filesChanged": ["shop/payments/schemas.py"] } }
  ],
  "contracts": [],
  "infraImpact": [
    { "file": "sample-app/Dockerfile", "layer": 3, "totalLayers": 7, "trigger": "requirements.txt changed (pydantic 1.10.13 -> 2.9.0)", "layersRebuilt": "3-7", "suggestion": "The dependency install layer is invalidated by the version bump; this rebuild is expected for a real upgrade. Keep requirements.txt in its own COPY so unrelated code changes do not trigger it." }
  ],
  "conventions": {
    "naming": "snake_case for functions and variables, PascalCase for Pydantic models",
    "imports": "absolute imports from shop.*, one schema class per file",
    "errorHandling": "raise NotFoundError / ValidationError; never return None on not-found",
    "fileLayout": "one module folder per domain (users, orders, payments) with a mirrored tests/<module>/ tree",
    "evidenceFiles": ["shop/users/service.py", "shop/orders/service.py", "shop/payments/schemas.py", "shop/config.py", "tests/users/test_routes.py"],
    "compliance": { "checkedLines": 22, "violations": 1, "retried": true }
  },
  "testsToRun": ["tests/notifications/test_email.py", "tests/users/test_routes.py", "tests/orders/test_service.py", "tests/payments/test_routes.py"],
  "untested": [],
  "risk": { "score": 40, "level": "medium", "factors": ["4 will_break (+40)"] },
  "pipeline": { "predict": "done", "prove": "done", "repair": "done", "verify": "done" },
  "migration": {
    "catalog": [
      { "id": "p2-basesettings", "title": "BaseSettings moved to pydantic-settings", "kind": "api_removed", "guideSection": "BaseSettings has moved to pydantic-settings", "detect": { "type": "import", "pattern": "from pydantic import BaseSettings" }, "replacement": "from pydantic_settings import BaseSettings", "occurrences": 1 },
      { "id": "p2-orm-mode", "title": "orm_mode renamed to from_attributes", "kind": "api_changed", "guideSection": "Changes to pydantic.BaseModel", "detect": { "type": "regex", "pattern": "orm_mode\\s*=\\s*True" }, "replacement": "model_config = ConfigDict(from_attributes=True)", "occurrences": 2 },
      { "id": "p2-optional-default", "title": "Optional fields are required unless they have a default", "kind": "behavior_changed", "guideSection": "Required, optional, and nullable fields", "detect": { "type": "regex", "pattern": ":\\s*Optional\\[[^\\]]+\\]\\s*$" }, "replacement": "add = None", "occurrences": 3 },
      { "id": "p2-field-regex", "title": "Field(regex=...) renamed to pattern", "kind": "api_changed", "guideSection": "Changes to pydantic.Field", "detect": { "type": "regex", "pattern": "regex\\s*=" }, "replacement": "pattern=", "occurrences": 1 }
    ],
    "modules": [
      { "module": "users", "worker": "uplift-worker-users", "filesChanged": ["shop/users/schemas.py"], "fixesApplied": 2, "testsBefore": { "passed": 9, "failed": 3 }, "testsAfter": { "passed": 12, "failed": 0 } },
      { "module": "orders", "worker": "uplift-worker-orders", "filesChanged": ["shop/orders/schemas.py"], "fixesApplied": 3, "testsBefore": { "passed": 10, "failed": 2 }, "testsAfter": { "passed": 12, "failed": 0 } },
      { "module": "payments", "worker": "uplift-worker-payments", "filesChanged": ["shop/payments/schemas.py"], "fixesApplied": 1, "testsBefore": { "passed": 8, "failed": 2 }, "testsAfter": { "passed": 10, "failed": 0 } },
      { "module": "core", "worker": "uplift-worker-core", "filesChanged": ["shop/config.py", "requirements.txt"], "fixesApplied": 2, "testsBefore": { "passed": 0, "failed": 2 }, "testsAfter": { "passed": 2, "failed": 0 } }
    ],
    "releaseNotes": "## Pydantic v2 upgrade\n\n- BaseSettings now imported from pydantic-settings\n- orm_mode replaced by from_attributes (2 places)\n- Optional fields given explicit defaults (3 places)\n- Field(regex=...) replaced by pattern (1 place)\n\nAll 36 tests pass on Pydantic v2."
  },
  "metrics": { "filesScanned": 31, "secondsTaken": 190, "predicted": 4, "confirmed": 4, "unconfirmed": 0, "fixed": 4, "regressions": 0, "tests": { "before": { "passed": 27, "failed": 9 }, "after": { "passed": 36, "failed": 0 } } }
}
