{
  "schemaVersion": 1,
  "mode": "impact",
  "provenance": {
    "generatedBy": "bob",
    "bobModes": [
      "uplift-impact-analyst",
      "uplift-prover",
      "uplift-worker-payments",
      "uplift-verifier"
    ],
    "generatedAt": "2026-09-27T10:01:52.488982+00:00"
  },
  "scenario": {
    "id": "s2-cents",
    "title": "S2 \u2014 Charge returns cents instead of dollars"
  },
  "change": {
    "summary": "Scenario s2-cents",
    "kind": "patch"
  },
  "changedSymbols": [
    {
      "id": "shop/payments/charge.py#Payment",
      "kind": "class",
      "changeType": "behavior",
      "hints": []
    },
    {
      "id": "shop/payments/charge.py#charge",
      "kind": "function",
      "changeType": "behavior",
      "hints": [
        "unit scaling added",
        "numeric literal changed"
      ]
    }
  ],
  "affected": [
    {
      "id": "shop/admin/reports.py#revenue_total",
      "file": "shop/admin/reports.py",
      "line": 15,
      "hop": 1,
      "layer": "direct",
      "verdict": "will_break",
      "reason": "Line 16 sums p.amount values and rounds to 2 decimal places assuming dollars; after patch the sum is ~100x larger and represents cents, silently returning a wrong total to every caller.",
      "fix": "Divide the sum by 100 before returning, or update callers to expect cents.",
      "proof": {
        "status": "confirmed",
        "testFile": "tests/uplift_proofs/test_admin_revenue_total.py",
        "passesOnBase": true,
        "failsOnHead": true
      },
      "module": "admin",
      "via": "shop/payments/charge.py#Payment",
      "snippet": "    return rows\n\n\ndef revenue_total(payments: List[Payment]) -> float:\n    return round(sum(p.amount for p in payments), 2)",
      "tests": []
    },
    {
      "id": "shop/notifications/email.py#send_receipt_email",
      "file": "shop/notifications/email.py",
      "line": 14,
      "hop": 1,
      "layer": "direct",
      "verdict": "will_break",
      "reason": "Line 15 formats payment.amount with ':.2f' as dollars; after patch the message reads '$10320.00' instead of '$103.20'.",
      "fix": "Divide payment.amount by 100 before formatting the f-string.",
      "proof": {
        "status": "confirmed",
        "testFile": "tests/uplift_proofs/test_notifications_send_receipt_email.py",
        "passesOnBase": true,
        "failsOnHead": true
      },
      "module": "notifications",
      "via": "shop/payments/charge.py#Payment",
      "snippet": "    return bool(f\"from {settings.sender} to {user.email}\")\n\n\ndef send_receipt_email(payment: Payment) -> str:\n    return f\"Thanks! We charged ${payment.amount:.2f}\"",
      "tests": [
        "tests/notifications/test_email.py"
      ]
    },
    {
      "id": "shop/orders/invoice.py#payment_line",
      "file": "shop/orders/invoice.py",
      "line": 15,
      "hop": 1,
      "layer": "direct",
      "verdict": "safe",
      "reason": "Line 16 passes payment.amount through as a dict value with no dollar assumption; the function is unit-agnostic.",
      "fix": "",
      "proof": {
        "status": "not_attempted"
      },
      "module": "orders",
      "via": "shop/payments/charge.py#Payment",
      "snippet": "    }\n\n\ndef payment_line(payment: Payment) -> dict:\n    return {\"label\": \"payment\", \"amount\": payment.amount}",
      "tests": [
        "tests/orders/test_invoice.py"
      ]
    },
    {
      "id": "shop/payments/receipt.py#render_receipt",
      "file": "shop/payments/receipt.py",
      "line": 5,
      "hop": 1,
      "layer": "direct",
      "verdict": "will_break",
      "reason": "Line 7 formats payment.amount with ':.2f' as dollars; after patch amount is in cents so output becomes '$10320.00' instead of '$103.20'.",
      "fix": "Divide payment.amount by 100 before formatting, or change the format string to show cents.",
      "proof": {
        "status": "confirmed",
        "testFile": "tests/uplift_proofs/test_payments_render_receipt.py",
        "passesOnBase": true,
        "failsOnHead": true
      },
      "module": "payments",
      "via": "shop/payments/charge.py#Payment",
      "snippet": "from shop.users.service import get_user\n\n\ndef render_receipt(payment: Payment) -> str:\n    user = get_user(payment.user_id)\n    return f\"Receipt for {user.name}: ${payment.amount:.2f}\"",
      "tests": [
        "tests/payments/test_receipt.py",
        "tests/payments/test_receipt_more.py"
      ]
    },
    {
      "id": "shop/payments/repo.py#save_payment",
      "file": "shop/payments/repo.py",
      "line": 8,
      "hop": 1,
      "layer": "direct",
      "verdict": "safe",
      "reason": "Line 9 only appends the Payment object to a list; no numeric interpretation of amount.",
      "fix": "",
      "proof": {
        "status": "not_attempted"
      },
      "module": "payments",
      "via": "shop/payments/charge.py#Payment",
      "snippet": "_PAYMENTS: List[Payment] = []\n\n\ndef save_payment(payment: Payment) -> Payment:\n    _PAYMENTS.append(payment)\n    return payment\n\n",
      "tests": [
        "tests/payments/test_repo.py",
        "tests/payments/test_routes.py"
      ]
    },
    {
      "id": "shop/payments/repo.py#all_payments",
      "file": "shop/payments/repo.py",
      "line": 13,
      "hop": 1,
      "layer": "direct",
      "verdict": "safe",
      "reason": "Returns the stored list as-is; no numeric operation on amount.",
      "fix": "",
      "proof": {
        "status": "not_attempted"
      },
      "module": "payments",
      "via": "shop/payments/charge.py#Payment",
      "snippet": "    return payment\n\n\ndef all_payments() -> List[Payment]:\n    return list(_PAYMENTS)\n\n\ndef reset() -> None:",
      "tests": [
        "tests/payments/test_repo.py",
        "tests/payments/test_routes.py"
      ]
    },
    {
      "id": "shop/payments/routes.py#post_payment",
      "file": "shop/payments/routes.py",
      "line": 11,
      "hop": 1,
      "layer": "direct",
      "verdict": "safe",
      "reason": "Line 12 echoes payment.amount directly into the JSON response without any dollar assumption; the API contract now returns cents, which callers must handle.",
      "fix": "",
      "proof": {
        "status": "not_attempted"
      },
      "module": "payments",
      "via": "shop/payments/charge.py#charge",
      "snippet": "\n@router.post(\"\")\ndef post_payment(payload: PaymentIn):\n    payment = repo.save_payment(charge.charge(payload.user_id, payload.amount))\n    return {\"user_id\": payment.user_id, \"amount\": payment.amount}",
      "tests": [
        "tests/payments/test_routes.py"
      ]
    }
  ],
  "contracts": [
    {
      "type": "route",
      "id": "POST /payments",
      "handler": "shop/payments/routes.py#post_payment",
      "verdict": "safe"
    }
  ],
  "testsToRun": [
    "tests/notifications/test_email.py",
    "tests/orders/test_invoice.py",
    "tests/payments/test_receipt.py",
    "tests/payments/test_receipt_more.py",
    "tests/payments/test_repo.py",
    "tests/payments/test_routes.py"
  ],
  "untested": [
    "shop/admin/reports.py#revenue_total"
  ],
  "risk": {
    "score": 42,
    "level": "medium",
    "factors": [
      "3 will_break (+30)",
      "0 might_break (+0)",
      "1 untested affected item (+12)",
      "0 contract hit (+0)"
    ]
  },
  "pipeline": {
    "predict": "done",
    "prove": "done",
    "repair": "pending",
    "verify": "done"
  },
  "migration": null,
  "metrics": {
    "filesScanned": 25,
    "secondsTaken": 0.5,
    "predicted": 3,
    "confirmed": 3,
    "unconfirmed": 0,
    "fixed": 0,
    "regressions": 0,
    "accuracy": {
      "precision": 1.0,
      "recall": 0.5,
      "truePositives": 3,
      "falsePositives": 0,
      "falseNegatives": 3
    }
  }
}